{
 "ticker": "3556",
 "company": "禾瑞亞",
 "legal_name": "禾瑞亞科技股份有限公司",
 "source": {
  "citation_url": "https://doc.twse.com.tw/server-java/t57sb01?step=9&kind=F&co_id=3556&filename=2025_3556_20260528F04.pdf",
  "fy": 2025,
  "filename": "2025_3556_20260528F04.pdf",
  "text_sha256": "05cf7def33a7cb76df6139d27bd34df14dc00b434ceeb66f8c56b550f5fa33c9",
  "text_path": "audit-v5/source-cache/research-site/mops-annual/05cf7def33a7cb76df6139d27bd34df14dc00b434ceeb66f8c56b550f5fa33c9.txt"
 },
 "facts": [
  {
   "id": "3556-AR-01",
   "field": "revenue_mix",
   "statement": "114年度觸控面板控制器／控制晶片營收為新臺幣931,785仟元，占營收比重96%。",
   "period": "114年度（2025）",
   "page": 59,
   "excerpts": [
    "主要商品 113 年度 114 年度",
    "觸控面板控制器／控制晶片 906,407 95% 931,785 96%"
   ],
   "attribution": "公司年報揭露",
   "verification": {
    "status": "PASS",
    "checks": {
     "source_hash": true,
     "excerpt_found": true,
     "page_match": true,
     "numbers_supported": true,
     "identity": true
    },
    "notes": [],
    "verified_at": "2026-10-17T18:34:46+00:00"
   }
  },
  {
   "id": "3556-AR-02",
   "field": "revenue_mix",
   "statement": "114年度USB影音控制晶片／模組營收為新臺幣35,683仟元，占營收比重4%。",
   "period": "114年度（2025）",
   "page": 59,
   "excerpts": [
    "主要商品 113 年度 114 年度",
    "USB 影音控制晶片/模組 49,187 5% 35,683 4%"
   ],
   "attribution": "公司年報揭露",
   "verification": {
    "status": "PASS",
    "checks": {
     "source_hash": true,
     "excerpt_found": true,
     "page_match": true,
     "numbers_supported": true,
     "identity": true
    },
    "notes": [],
    "verified_at": "2026-10-17T18:34:46+00:00"
   }
  },
  {
   "id": "3556-AR-03",
   "field": "business_scope",
   "statement": "公司目前商品項目包括電阻式、表面式電容及投射式電容觸控面板控制器／控制晶片。",
   "period": "截至年報刊印日",
   "page": 59,
   "excerpts": [
    "電阻式 控制器",
    "表面式電容 控制器",
    "投射式電容 控制器"
   ],
   "attribution": "公司年報揭露",
   "verification": {
    "status": "PASS",
    "checks": {
     "source_hash": true,
     "excerpt_found": true,
     "page_match": true,
     "numbers_supported": true,
     "identity": true
    },
    "notes": [],
    "verified_at": "2026-10-17T18:34:46+00:00"
   }
  },
  {
   "id": "3556-AR-04",
   "field": "market_position",
   "statement": "公司於年報自述在工控相關領域上持續維持競爭優勢。",
   "period": "截至年報刊印日",
   "page": 70,
   "excerpts": [
    "在工控相關領域上持續維持競爭優勢"
   ],
   "attribution": "公司年報自述（未經獨立驗證的排名或評價）",
   "verification": {
    "status": "PASS",
    "checks": {
     "source_hash": true,
     "excerpt_found": true,
     "page_match": true,
     "numbers_supported": true,
     "identity": true
    },
    "notes": [],
    "verified_at": "2026-10-17T18:34:46+00:00"
   }
  },
  {
   "id": "3556-AR-05",
   "field": "market_position",
   "statement": "公司於年報自述為目前全球極少數擁有多種中、大尺寸觸控技術，並能提供完整軟硬體解決方案的廠商。",
   "period": "截至年報刊印日",
   "page": 71,
   "excerpts": [
    "為目前全球極少數擁有多種中、大尺寸觸控技術，並能提供完整軟硬體解決方案的廠商"
   ],
   "attribution": "公司年報自述（未經獨立驗證的排名或評價）",
   "verification": {
    "status": "PASS",
    "checks": {
     "source_hash": true,
     "excerpt_found": true,
     "page_match": true,
     "numbers_supported": true,
     "identity": true
    },
    "notes": [],
    "verified_at": "2026-10-17T18:34:46+00:00"
   }
  },
  {
   "id": "3556-AR-06",
   "field": "major_customers",
   "statement": "114年度銷貨客戶禾伸堂金額為新臺幣306,467仟元，占全年度銷貨淨額32%，該公司之董事長與本公司之董事長為同一人。",
   "period": "114年度（2025）",
   "page": 75,
   "excerpts": [
    "113 年度 114 年度",
    "禾伸堂 306,467 32",
    "該公司之董事長與本公司之董事長為同一人"
   ],
   "attribution": "公司年報揭露",
   "verification": {
    "status": "PASS",
    "checks": {
     "source_hash": true,
     "excerpt_found": true,
     "page_match": true,
     "numbers_supported": true,
     "identity": true
    },
    "notes": [],
    "verified_at": "2026-10-17T18:34:46+00:00"
   }
  },
  {
   "id": "3556-AR-07",
   "field": "major_suppliers",
   "statement": "114年度進貨廠商A（代號）金額為新臺幣89,522仟元，占全年度進貨淨額42%。",
   "period": "114年度（2025）",
   "page": 75,
   "excerpts": [
    "113 年度 114 年度",
    "A 89,522 42 無"
   ],
   "attribution": "公司年報揭露",
   "verification": {
    "status": "PASS",
    "checks": {
     "source_hash": true,
     "excerpt_found": true,
     "page_match": true,
     "numbers_supported": true,
     "identity": true
    },
    "notes": [],
    "verified_at": "2026-10-17T18:34:46+00:00"
   }
  },
  {
   "id": "3556-AR-08",
   "field": "employees",
   "statement": "114年度從業員工合計為187人（員工人數表未載明為母公司或合併範圍）。",
   "period": "114年度（2025）",
   "page": 76,
   "excerpts": [
    "113 年度 114 年度",
    "合計 187 187 186"
   ],
   "attribution": "公司年報揭露",
   "verification": {
    "status": "PASS",
    "checks": {
     "source_hash": true,
     "excerpt_found": true,
     "page_match": true,
     "numbers_supported": true,
     "identity": true
    },
    "notes": [],
    "verified_at": "2026-10-17T18:34:46+00:00"
   }
  },
  {
   "id": "3556-AR-09",
   "field": "rd",
   "statement": "114年度研發人員為103人。",
   "period": "114年度（2025）",
   "page": 76,
   "excerpts": [
    "113 年度 114 年度",
    "研發人員 98 103 102"
   ],
   "attribution": "公司年報揭露",
   "verification": {
    "status": "PASS",
    "checks": {
     "source_hash": true,
     "excerpt_found": true,
     "page_match": true,
     "numbers_supported": true,
     "identity": true
    },
    "notes": [],
    "verified_at": "2026-10-17T18:34:46+00:00"
   }
  }
 ]
}
