{
 "ticker": "2942",
 "company": "京站",
 "legal_name": "京站實業股份有限公司",
 "source": {
  "citation_url": "https://doc.twse.com.tw/server-java/t57sb01?step=9&kind=F&co_id=2942&filename=2025_2942_20260611F04.pdf",
  "fy": 2025,
  "filename": "2025_2942_20260611F04.pdf",
  "text_sha256": "aa438256c480f6ca48f1d6d2bb7a68b4e4602d6ae31b756f0cdd3e524c943b8b",
  "text_path": "audit-v5/source-cache/research-site/mops-annual/aa438256c480f6ca48f1d6d2bb7a68b4e4602d6ae31b756f0cdd3e524c943b8b.txt"
 },
 "facts": [
  {
   "id": "2942-AR-01",
   "field": "business_scope",
   "statement": "年報載明公司之營業項目係為百貨公司業，主要為提供消費者購物、餐飲等服務。",
   "period": "截至114年度年報刊印日",
   "page": 50,
   "excerpts": [
    "本公司之營業項目係為百貨公司業，主要為提供消費者購物、餐飲等服務"
   ],
   "attribution": "公司年報揭露",
   "verification": {
    "status": "PASS",
    "checks": {
     "source_hash": true,
     "excerpt_found": true,
     "page_match": true,
     "numbers_supported": true,
     "identity": true
    },
    "notes": [],
    "verified_at": "2026-10-13T00:23:44+00:00"
   }
  },
  {
   "id": "2942-AR-02",
   "field": "revenue_mix",
   "statement": "114年度百貨收入銷售金額為新臺幣1,096,606仟元，比例82.86%（營業比重表）。",
   "period": "114年度（2025）",
   "page": 46,
   "excerpts": [
    "單位：新臺幣仟元",
    "113年度 114年度",
    "銷售金額 比例(%) 銷售金額 比例(%)",
    "百貨收入 1,081,822 80.76 1,096,606 82.86"
   ],
   "attribution": "公司年報揭露",
   "verification": {
    "status": "PASS",
    "checks": {
     "source_hash": true,
     "excerpt_found": true,
     "page_match": true,
     "numbers_supported": true,
     "identity": true
    },
    "notes": [],
    "verified_at": "2026-10-13T00:23:44+00:00"
   }
  },
  {
   "id": "2942-AR-03",
   "field": "revenue_mix",
   "statement": "114年度商品銷售收入銷售金額為新臺幣90,956仟元，比例6.87%（營業比重表）。",
   "period": "114年度（2025）",
   "page": 46,
   "excerpts": [
    "單位：新臺幣仟元",
    "113年度 114年度",
    "銷售金額 比例(%) 銷售金額 比例(%)",
    "商品銷售收入 118,581 8.85 90,956 6.87"
   ],
   "attribution": "公司年報揭露",
   "verification": {
    "status": "PASS",
    "checks": {
     "source_hash": true,
     "excerpt_found": true,
     "page_match": true,
     "numbers_supported": true,
     "identity": true
    },
    "notes": [],
    "verified_at": "2026-10-13T00:23:44+00:00"
   }
  },
  {
   "id": "2942-AR-04",
   "field": "revenue_mix",
   "statement": "114年度租賃收入銷售金額為新臺幣72,589仟元，比例5.48%（營業比重表）。",
   "period": "114年度（2025）",
   "page": 46,
   "excerpts": [
    "單位：新臺幣仟元",
    "113年度 114年度",
    "銷售金額 比例(%) 銷售金額 比例(%)",
    "租賃收入 74,378 5.55 72,589 5.48"
   ],
   "attribution": "公司年報揭露",
   "verification": {
    "status": "PASS",
    "checks": {
     "source_hash": true,
     "excerpt_found": true,
     "page_match": true,
     "numbers_supported": true,
     "identity": true
    },
    "notes": [],
    "verified_at": "2026-10-13T00:23:44+00:00"
   }
  },
  {
   "id": "2942-AR-05",
   "field": "revenue_mix",
   "statement": "114年度停車場收入銷售金額為新臺幣59,979仟元，比例4.54%（營業比重表）。",
   "period": "114年度（2025）",
   "page": 46,
   "excerpts": [
    "單位：新臺幣仟元",
    "113年度 114年度",
    "銷售金額 比例(%) 銷售金額 比例(%)",
    "停車場收入 60,474 4.52 59,979 4.54"
   ],
   "attribution": "公司年報揭露",
   "verification": {
    "status": "PASS",
    "checks": {
     "source_hash": true,
     "excerpt_found": true,
     "page_match": true,
     "numbers_supported": true,
     "identity": true
    },
    "notes": [],
    "verified_at": "2026-10-13T00:23:44+00:00"
   }
  },
  {
   "id": "2942-AR-06",
   "field": "revenue_mix",
   "statement": "114年度其他收入銷售金額為新臺幣3,342仟元，比例0.25%（營業比重表）。",
   "period": "114年度（2025）",
   "page": 46,
   "excerpts": [
    "單位：新臺幣仟元",
    "113年度 114年度",
    "銷售金額 比例(%) 銷售金額 比例(%)",
    "其他收入 4,237 0.32 3,342 0.25"
   ],
   "attribution": "公司年報揭露",
   "verification": {
    "status": "PASS",
    "checks": {
     "source_hash": true,
     "excerpt_found": true,
     "page_match": true,
     "numbers_supported": true,
     "identity": true
    },
    "notes": [],
    "verified_at": "2026-10-13T00:23:44+00:00"
   }
  },
  {
   "id": "2942-AR-07",
   "field": "revenue_mix",
   "statement": "114年度營業比重表合計銷售金額為新臺幣1,323,472仟元。",
   "period": "114年度（2025）",
   "page": 46,
   "excerpts": [
    "單位：新臺幣仟元",
    "113年度 114年度",
    "銷售金額 比例(%) 銷售金額 比例(%)",
    "合計 1,339,492 100.00 1,323,472 100.00"
   ],
   "attribution": "公司年報揭露",
   "verification": {
    "status": "PASS",
    "checks": {
     "source_hash": true,
     "excerpt_found": true,
     "page_match": true,
     "numbers_supported": true,
     "identity": true
    },
    "notes": [],
    "verified_at": "2026-10-13T00:23:44+00:00"
   }
  },
  {
   "id": "2942-AR-08",
   "field": "sales_regions",
   "statement": "114年度內銷銷售金額為新臺幣1,323,472仟元，比例100%（占銷售地區表合計）。",
   "period": "114年度（2025）",
   "page": 51,
   "excerpts": [
    "單位：新臺幣仟元",
    "113年度 114年度",
    "銷售金額 比例(%) 銷售金額 比例(%)",
    "內銷 1,339,492 100% 1,323,472 100%"
   ],
   "attribution": "公司年報揭露",
   "verification": {
    "status": "PASS",
    "checks": {
     "source_hash": true,
     "excerpt_found": true,
     "page_match": true,
     "numbers_supported": true,
     "identity": true
    },
    "notes": [],
    "verified_at": "2026-10-13T00:23:44+00:00"
   }
  },
  {
   "id": "2942-AR-09",
   "field": "major_suppliers",
   "statement": "114年度向萊雅進貨金額為新臺幣23,401仟元，占全年度進貨淨額比率33.61%。",
   "period": "114年度（2025）",
   "page": 53,
   "excerpts": [
    "單位：新臺幣仟元；%",
    "年度 113年度 114年度",
    "占全年度進 貨淨額比率 (%)",
    "萊雅 30,021 29.63 - 萊雅 23,401 33.61 -"
   ],
   "attribution": "公司年報揭露",
   "verification": {
    "status": "PASS",
    "checks": {
     "source_hash": true,
     "excerpt_found": true,
     "page_match": true,
     "numbers_supported": true,
     "identity": true
    },
    "notes": [],
    "verified_at": "2026-10-13T00:23:44+00:00"
   }
  },
  {
   "id": "2942-AR-10",
   "field": "major_suppliers",
   "statement": "114年度向法倈麗進貨金額為新臺幣17,562仟元，占全年度進貨淨額比率25.23%。",
   "period": "114年度（2025）",
   "page": 53,
   "excerpts": [
    "單位：新臺幣仟元；%",
    "年度 113年度 114年度",
    "占全年度進 貨淨額比率 (%)",
    "法倈麗 21,639 21.36 - 法倈麗 17,562 25.23 -"
   ],
   "attribution": "公司年報揭露",
   "verification": {
    "status": "PASS",
    "checks": {
     "source_hash": true,
     "excerpt_found": true,
     "page_match": true,
     "numbers_supported": true,
     "identity": true
    },
    "notes": [],
    "verified_at": "2026-10-13T00:23:44+00:00"
   }
  },
  {
   "id": "2942-AR-11",
   "field": "major_suppliers",
   "statement": "114年度向寶潔進貨金額為新臺幣12,710仟元，占全年度進貨淨額比率18.26%。",
   "period": "114年度（2025）",
   "page": 53,
   "excerpts": [
    "單位：新臺幣仟元；%",
    "年度 113年度 114年度",
    "占全年度進 貨淨額比率 (%)",
    "寶潔 12,710 18.26 -"
   ],
   "attribution": "公司年報揭露",
   "verification": {
    "status": "PASS",
    "checks": {
     "source_hash": true,
     "excerpt_found": true,
     "page_match": true,
     "numbers_supported": true,
     "identity": true
    },
    "notes": [],
    "verified_at": "2026-10-13T00:23:44+00:00"
   }
  },
  {
   "id": "2942-AR-12",
   "field": "major_suppliers",
   "statement": "114年度向雅詩蘭黛進貨金額為新臺幣10,548仟元，占全年度進貨淨額比率15.15%。",
   "period": "114年度（2025）",
   "page": 53,
   "excerpts": [
    "單位：新臺幣仟元；%",
    "年度 113年度 114年度",
    "占全年度進 貨淨額比率 (%)",
    "雅詩蘭黛 10,548 15.15 -"
   ],
   "attribution": "公司年報揭露",
   "verification": {
    "status": "PASS",
    "checks": {
     "source_hash": true,
     "excerpt_found": true,
     "page_match": true,
     "numbers_supported": true,
     "identity": true
    },
    "notes": [],
    "verified_at": "2026-10-13T00:23:44+00:00"
   }
  },
  {
   "id": "2942-AR-13",
   "field": "major_suppliers",
   "statement": "年報載明公司114年度較113年度之進貨金額減少，主要係自營專櫃櫃位調整所致。",
   "period": "114年度（2025）",
   "page": 53,
   "excerpts": [
    "本公司114年度較 113年度之進貨金額減少，主要係自營專櫃櫃位調整所致"
   ],
   "attribution": "公司年報揭露",
   "verification": {
    "status": "PASS",
    "checks": {
     "source_hash": true,
     "excerpt_found": true,
     "page_match": true,
     "numbers_supported": true,
     "identity": true
    },
    "notes": [],
    "verified_at": "2026-10-13T00:23:44+00:00"
   }
  },
  {
   "id": "2942-AR-14",
   "field": "employees",
   "statement": "114年度員工人數合計為209人（員工人數表未載明為母公司或合併範圍）。",
   "period": "114年度（2025）",
   "page": 53,
   "excerpts": [
    "年 度 113年度 114 年度 115 年度截至",
    "合 計 198 209 208"
   ],
   "attribution": "公司年報揭露",
   "verification": {
    "status": "PASS",
    "checks": {
     "source_hash": true,
     "excerpt_found": true,
     "page_match": true,
     "numbers_supported": true,
     "identity": true
    },
    "notes": [],
    "verified_at": "2026-10-13T00:23:44+00:00"
   }
  },
  {
   "id": "2942-AR-15",
   "field": "group_structure",
   "statement": "年報載明公司於114年11月簽訂「京饌餐旅事業股份有限公司」67%股權買賣契約，並於115年1月完成股權交割併入京站之子公司。",
   "period": "114年11月至115年1月",
   "page": 50,
   "excerpts": [
    "於 114 年 11 月簽訂「京饌餐旅事業股份有限公司」67%股權買賣契 約，並於 115 年 1 月完成股權交割併入京站之子公司"
   ],
   "attribution": "公司年報揭露",
   "verification": {
    "status": "PASS",
    "checks": {
     "source_hash": true,
     "excerpt_found": true,
     "page_match": true,
     "numbers_supported": true,
     "identity": true
    },
    "notes": [],
    "verified_at": "2026-10-13T00:23:44+00:00"
   }
  },
  {
   "id": "2942-AR-16",
   "field": "outlook",
   "statement": "年報載明公司已於111年末與隆遠集團簽訂新商場之租賃契約，預計於118年可運營。",
   "period": "111年末起",
   "page": 50,
   "excerpts": [
    "業已於 111 年 末與隆遠集團簽訂新商場之租賃契約，預計於 118 年可運營"
   ],
   "attribution": "公司年報揭露",
   "verification": {
    "status": "PASS",
    "checks": {
     "source_hash": true,
     "excerpt_found": true,
     "page_match": true,
     "numbers_supported": true,
     "identity": true
    },
    "notes": [],
    "verified_at": "2026-10-13T00:23:44+00:00"
   }
  }
 ]
}
