{
 "ticker": "1604",
 "company": "聲寶",
 "legal_name": "聲寶股份有限公司",
 "source": {
  "citation_url": "https://doc.twse.com.tw/server-java/t57sb01?step=9&kind=F&co_id=1604&filename=2025_1604_20260616F04.pdf",
  "fy": 2025,
  "filename": "2025_1604_20260616F04.pdf",
  "text_sha256": "10cf8f44217134060b34cfe754c02d3085c5ba41bbc10307849fea5eae41b28d",
  "text_path": "audit-v5/source-cache/research-site/mops-annual/10cf8f44217134060b34cfe754c02d3085c5ba41bbc10307849fea5eae41b28d.txt"
 },
 "facts": [
  {
   "field": "revenue_mix",
   "statement": "114年度電子及家電產品的營業比重為90.28%。",
   "period": "114年度（2025）",
   "page": 82,
   "excerpts": [
    "項目 114 年度營業比重",
    "電子及家電產品 90.28%"
   ],
   "id": "1604-AR-01",
   "attribution": "公司年報揭露",
   "verification": {
    "status": "PASS",
    "checks": {
     "source_hash": true,
     "excerpt_found": true,
     "page_match": true,
     "numbers_supported": true,
     "identity": true
    },
    "notes": [],
    "verified_at": "2026-10-12T18:52:00+00:00"
   }
  },
  {
   "field": "revenue_mix",
   "statement": "114年度運輸業務及其他的營業比重為9.72%。",
   "period": "114年度（2025）",
   "page": 82,
   "excerpts": [
    "項目 114 年度營業比重",
    "運輸業務及其他 9.72%"
   ],
   "id": "1604-AR-02",
   "attribution": "公司年報揭露",
   "verification": {
    "status": "PASS",
    "checks": {
     "source_hash": true,
     "excerpt_found": true,
     "page_match": true,
     "numbers_supported": true,
     "identity": true
    },
    "notes": [],
    "verified_at": "2026-10-12T18:52:00+00:00"
   }
  },
  {
   "field": "business_scope",
   "statement": "公司電子產品類業務以顯示器與智慧影音系統為核心，涵蓋研發、製造、品牌內外銷及OEM／ODM服務。",
   "period": "截至114年度年報刊印日",
   "page": 82,
   "excerpts": [
    "顯示器與智慧影音系統為核心，涵蓋研\n發、製造、品牌內外銷及 OEM／ODM 服\n務。"
   ],
   "id": "1604-AR-03",
   "attribution": "公司年報揭露",
   "verification": {
    "status": "PASS",
    "checks": {
     "source_hash": true,
     "excerpt_found": true,
     "page_match": true,
     "numbers_supported": true,
     "identity": true
    },
    "notes": [],
    "verified_at": "2026-10-12T18:52:00+00:00"
   }
  },
  {
   "field": "products",
   "statement": "電子產品類主要產品項目包括LED 顯示器、視訊會議顯示器、監控用顯示器、收銀機系統顯示器等。",
   "period": "截至114年度年報刊印日",
   "page": 82,
   "excerpts": [
    "主要產品項目：",
    "LED 顯示器(轟天雷高音質/多媒體顯示器/\n量子點顯示器)、視訊會議顯示器、監控用\n顯示器、收銀機系統顯示器"
   ],
   "id": "1604-AR-04",
   "attribution": "公司年報揭露",
   "verification": {
    "status": "PASS",
    "checks": {
     "source_hash": true,
     "excerpt_found": true,
     "page_match": true,
     "numbers_supported": true,
     "identity": true
    },
    "notes": [],
    "verified_at": "2026-10-12T18:52:00+00:00"
   }
  },
  {
   "field": "products",
   "statement": "家電產品類產品包括電冰箱、冷凍櫃、冷藏櫃、洗衣機、乾衣機、冷氣機等。",
   "period": "截至114年度年報刊印日",
   "page": 82,
   "excerpts": [
    "電冰箱、冷凍櫃、冷藏櫃、洗衣機、滾筒\n洗衣機、乾衣機、冷氣機"
   ],
   "id": "1604-AR-05",
   "attribution": "公司年報揭露",
   "verification": {
    "status": "PASS",
    "checks": {
     "source_hash": true,
     "excerpt_found": true,
     "page_match": true,
     "numbers_supported": true,
     "identity": true
    },
    "notes": [],
    "verified_at": "2026-10-12T18:52:00+00:00"
   }
  },
  {
   "field": "sales_regions",
   "statement": "年報列示電子產品類的主要銷售地區包括台灣、美洲、歐洲、亞洲。",
   "period": "截至114年度年報刊印日",
   "page": 89,
   "excerpts": [
    "主要產品 主要銷售地區",
    "電子產品類 台灣、美洲、歐洲、亞洲"
   ],
   "id": "1604-AR-06",
   "attribution": "公司年報揭露",
   "verification": {
    "status": "PASS",
    "checks": {
     "source_hash": true,
     "excerpt_found": true,
     "page_match": true,
     "numbers_supported": true,
     "identity": true
    },
    "notes": [],
    "verified_at": "2026-10-12T18:52:00+00:00"
   }
  },
  {
   "field": "sales_regions",
   "statement": "年報列示家電產品類的主要銷售地區包括台灣、亞洲。",
   "period": "截至114年度年報刊印日",
   "page": 89,
   "excerpts": [
    "主要產品 主要銷售地區",
    "家電產品類 台灣、亞洲"
   ],
   "id": "1604-AR-07",
   "attribution": "公司年報揭露",
   "verification": {
    "status": "PASS",
    "checks": {
     "source_hash": true,
     "excerpt_found": true,
     "page_match": true,
     "numbers_supported": true,
     "identity": true
    },
    "notes": [],
    "verified_at": "2026-10-12T18:52:00+00:00"
   }
  },
  {
   "field": "rd",
   "statement": "表列114年度研發費用為118,647仟元（原文未載幣別）。",
   "period": "114年度（2025）",
   "page": 87,
   "excerpts": [
    "單位：仟元",
    "項目/年度 114 年度 113 年度 115 年截至",
    "研發費用 118,647 111,771 33,642"
   ],
   "id": "1604-AR-08",
   "attribution": "公司年報揭露",
   "verification": {
    "status": "PASS",
    "checks": {
     "source_hash": true,
     "excerpt_found": true,
     "page_match": true,
     "numbers_supported": true,
     "identity": true
    },
    "notes": [],
    "verified_at": "2026-10-12T18:52:00+00:00"
   }
  },
  {
   "field": "revenue_mix",
   "statement": "表列114年度營業收入為9,049,770仟元（原文未載幣別）。",
   "period": "114年度（2025）",
   "page": 87,
   "excerpts": [
    "單位：仟元",
    "項目/年度 114 年度 113 年度 115 年截至",
    "營業收入 9,049,770 9,493,807 3,188,120"
   ],
   "id": "1604-AR-09",
   "attribution": "公司年報揭露",
   "verification": {
    "status": "PASS",
    "checks": {
     "source_hash": true,
     "excerpt_found": true,
     "page_match": true,
     "numbers_supported": true,
     "identity": true
    },
    "notes": [],
    "verified_at": "2026-10-12T18:52:00+00:00"
   }
  },
  {
   "field": "major_customers",
   "statement": "114年度銷貨客戶表列的某客戶（A 公司）銷貨金額為1,130,400仟元（原文未載幣別），占全年度銷貨淨額12%，與發行人之關係為無。",
   "period": "114年度（2025）",
   "page": 102,
   "excerpts": [
    "2.最近二年度主要銷貨客戶資料：",
    "單元：仟元",
    "年度 114 年 113 年 115 年度截至前一季止",
    "1 A 公司 1,130,400 12% 無 A 公司 1,367,702 14% 無 A 公司 288,161 12% 無"
   ],
   "id": "1604-AR-10",
   "attribution": "公司年報揭露",
   "verification": {
    "status": "PASS",
    "checks": {
     "source_hash": true,
     "excerpt_found": true,
     "page_match": true,
     "numbers_supported": true,
     "identity": true
    },
    "notes": [],
    "verified_at": "2026-10-12T18:52:00+00:00"
   }
  },
  {
   "field": "major_suppliers",
   "statement": "114年度供應商表列的某供應商（A 公司）進貨金額為333,835仟元（原文未載幣別），占全年度進貨淨額11%，與發行人之關係為無。",
   "period": "114年度（2025）",
   "page": 102,
   "excerpts": [
    "1.最近二年度主要供應商資料：",
    "單元：仟元",
    "年度 114 年 113 年 115 年度截至前一季止",
    "1 A 公司 333,835 11% 無 A 公司 284,643 8% 無 A 公司 101,947 8% 無"
   ],
   "id": "1604-AR-11",
   "attribution": "公司年報揭露",
   "verification": {
    "status": "PASS",
    "checks": {
     "source_hash": true,
     "excerpt_found": true,
     "page_match": true,
     "numbers_supported": true,
     "identity": true
    },
    "notes": [],
    "verified_at": "2026-10-12T18:52:00+00:00"
   }
  },
  {
   "field": "employees",
   "statement": "114年度員工人數合計為1,085人（員工人數表未載明為母公司或合併範圍）。",
   "period": "114年度（2025）",
   "page": 103,
   "excerpts": [
    "年度 113年度 114年度 當年度截至",
    "合計 1,110 1,085 1063"
   ],
   "id": "1604-AR-12",
   "attribution": "公司年報揭露",
   "verification": {
    "status": "PASS",
    "checks": {
     "source_hash": true,
     "excerpt_found": true,
     "page_match": true,
     "numbers_supported": true,
     "identity": true
    },
    "notes": [],
    "verified_at": "2026-10-12T18:52:00+00:00"
   }
  },
  {
   "field": "raw_materials",
   "statement": "年報載明電子產品類主要原料之一的面板由國外進口及國內廠商供應。",
   "period": "截至114年度年報刊印日",
   "page": 101,
   "excerpts": [
    "1.電子產品類之主要原料，無供應上缺貨之現象，供應狀況表如下：",
    "主要原料 供應狀況",
    "面板 由國外進口及國內廠商供應"
   ],
   "id": "1604-AR-13",
   "attribution": "公司年報揭露",
   "verification": {
    "status": "PASS",
    "checks": {
     "source_hash": true,
     "excerpt_found": true,
     "page_match": true,
     "numbers_supported": true,
     "identity": true
    },
    "notes": [],
    "verified_at": "2026-10-12T18:52:00+00:00"
   }
  },
  {
   "field": "raw_materials",
   "statement": "年報載明家電產品類主要原料之一的塑膠材料主要由國內廠商供應。",
   "period": "截至114年度年報刊印日",
   "page": 101,
   "excerpts": [
    "2.家電產品類：",
    "主要原料 供應狀況",
    "塑膠材料 主要由國內廠商供應"
   ],
   "id": "1604-AR-14",
   "attribution": "公司年報揭露",
   "verification": {
    "status": "PASS",
    "checks": {
     "source_hash": true,
     "excerpt_found": true,
     "page_match": true,
     "numbers_supported": true,
     "identity": true
    },
    "notes": [],
    "verified_at": "2026-10-12T18:52:00+00:00"
   }
  },
  {
   "field": "raw_materials",
   "statement": "年報載明家電產品類主要原料之一的壓縮機由國外進口及國內廠商供應。",
   "period": "截至114年度年報刊印日",
   "page": 101,
   "excerpts": [
    "2.家電產品類：",
    "主要原料 供應狀況",
    "壓縮機 由國外進口及國內廠商供應"
   ],
   "id": "1604-AR-15",
   "attribution": "公司年報揭露",
   "verification": {
    "status": "PASS",
    "checks": {
     "source_hash": true,
     "excerpt_found": true,
     "page_match": true,
     "numbers_supported": true,
     "identity": true
    },
    "notes": [],
    "verified_at": "2026-10-12T18:52:00+00:00"
   }
  },
  {
   "field": "outlook",
   "statement": "公司於年報表示，2026年市場策略中，銷售策略將持續集中於4K大尺寸聯網顯示器，並以13萬台為年度目標。",
   "period": "2026年",
   "page": 90,
   "excerpts": [
    "2026 年市場策略：",
    "銷售策略將持續集中於  4K 大尺寸聯網顯示器，深化通",
    "路與平台合作，擴大市場覆蓋，並以 13 萬台為年度目標。"
   ],
   "id": "1604-AR-16",
   "attribution": "公司年報揭露",
   "verification": {
    "status": "PASS",
    "checks": {
     "source_hash": true,
     "excerpt_found": true,
     "page_match": true,
     "numbers_supported": true,
     "identity": true
    },
    "notes": [],
    "verified_at": "2026-10-12T18:52:00+00:00"
   }
  },
  {
   "field": "market_position",
   "statement": "公司於年報自述，天廚微波爐今年度持續穩國產品牌市佔率第一。",
   "period": "截至114年度年報刊印日",
   "page": 94,
   "excerpts": [
    "天廚微波爐持續領先業界，今年度持續穩國產品牌市",
    "佔率第一，堅持不斷的創新"
   ],
   "attribution": "公司年報自述（未經獨立驗證的排名或評價）",
   "id": "1604-AR-17",
   "verification": {
    "status": "PASS",
    "checks": {
     "source_hash": true,
     "excerpt_found": true,
     "page_match": true,
     "numbers_supported": true,
     "identity": true
    },
    "notes": [],
    "verified_at": "2026-10-12T18:52:00+00:00"
   }
  }
 ]
}
