{
 "ticker": "5516",
 "company": "雙喜",
 "legal_name": "雙喜營造股份有限公司",
 "source": {
  "citation_url": "https://doc.twse.com.tw/server-java/t57sb01?step=9&kind=F&co_id=5516&filename=2025_5516_20260617F04.pdf",
  "fy": 2025,
  "filename": "2025_5516_20260617F04.pdf",
  "text_sha256": "542b7f11c1a135335c0a9dfdccdd842046b790cc07cf840a6dd814938d9c4a78",
  "text_path": "audit-v5/source-cache/research-site/mops-annual/542b7f11c1a135335c0a9dfdccdd842046b790cc07cf840a6dd814938d9c4a78.txt"
 },
 "facts": [
  {
   "id": "5516-AR-01",
   "field": "headquarters",
   "statement": "公司總公司位於新竹市民族路186號。",
   "period": "截至114年度年報刊印日",
   "page": 2,
   "excerpts": [
    "總 公 司：新竹市民族路 186 號"
   ],
   "attribution": "公司年報揭露",
   "verification": {
    "status": "PASS",
    "checks": {
     "source_hash": true,
     "excerpt_found": true,
     "page_match": true,
     "numbers_supported": true,
     "identity": true
    },
    "notes": [],
    "verified_at": "2026-10-12T13:56:41+00:00"
   }
  },
  {
   "id": "5516-AR-02",
   "field": "business_scope",
   "statement": "公司主要業務內容包括建築工程（辦公大樓、旅館建築、學校建築）、土木工程（一般土木、土地重劃）及統包及其他工程（社會住宅及區段徴收統包工程、零星修繕工程）。",
   "period": "截至114年度年報刊印日",
   "page": 49,
   "excerpts": [
    "建築工程：辦公大樓、旅館建築、學校建築",
    "土木工程：一般土木、土地重劃",
    "統包及其他工程：社會住宅及區段徴收統包工程、零星修繕工程"
   ],
   "attribution": "公司年報揭露",
   "verification": {
    "status": "PASS",
    "checks": {
     "source_hash": true,
     "excerpt_found": true,
     "page_match": true,
     "numbers_supported": true,
     "identity": true
    },
    "notes": [],
    "verified_at": "2026-10-12T13:56:41+00:00"
   }
  },
  {
   "id": "5516-AR-03",
   "field": "sales_regions",
   "statement": "公司於114年度承攬工程案分佈於台北市及桃竹苗區。",
   "period": "114年度（2025）",
   "page": 50,
   "excerpts": [
    "114 年度主要之銷售（提供）地區",
    "本公司目前承攬工程案分佈於台北市及桃竹苗區"
   ],
   "attribution": "公司年報揭露",
   "verification": {
    "status": "PASS",
    "checks": {
     "source_hash": true,
     "excerpt_found": true,
     "page_match": true,
     "numbers_supported": true,
     "identity": true
    },
    "notes": [],
    "verified_at": "2026-10-12T13:56:41+00:00"
   }
  },
  {
   "id": "5516-AR-04",
   "field": "market_position",
   "statement": "公司於年報自述，依114年度財政統計營利事業銷售額(累計)報表資料，114年度營建工程業銷售額為4,697,860佰萬元，公司114年度營業額為2,177佰萬元（原文均未載幣別），佔有率為0.04%。",
   "period": "114年度（2025）",
   "page": 50,
   "excerpts": [
    "依 114 年度財政統計營利事業銷售額(累計)報表資料顯示 114 年度營建工程業銷售額為 4,697,860 佰萬元",
    "本公司 114 年度營業額為 2,177 佰萬元",
    "佔有率為 0.04%"
   ],
   "attribution": "公司年報自述（未經獨立驗證的排名或評價）",
   "verification": {
    "status": "PASS",
    "checks": {
     "source_hash": true,
     "excerpt_found": true,
     "page_match": true,
     "numbers_supported": true,
     "identity": true
    },
    "notes": [],
    "verified_at": "2026-10-12T13:56:41+00:00"
   }
  },
  {
   "id": "5516-AR-05",
   "field": "rd",
   "statement": "公司技術及研發概況列載採用系統鋁模取代傳統木模，以及導入住宅單元樓板KT版。",
   "period": "截至114年度年報刊印日",
   "page": 50,
   "excerpts": [
    "(三)技術及研發概況",
    "採用系統鋁模取代傳統木模",
    "導入住宅單元樓板 KT 版"
   ],
   "attribution": "公司年報揭露",
   "verification": {
    "status": "PASS",
    "checks": {
     "source_hash": true,
     "excerpt_found": true,
     "page_match": true,
     "numbers_supported": true,
     "identity": true
    },
    "notes": [],
    "verified_at": "2026-10-12T13:56:41+00:00"
   }
  },
  {
   "id": "5516-AR-06",
   "field": "outlook",
   "statement": "公司於年報載明短期業務發展計畫為承接各項公共工程如社會住宅、危老屋重建及都市更新及開發等、污水工程、土地重劃工程。",
   "period": "截至114年度年報刊印日",
   "page": 50,
   "excerpts": [
    "短期：各項公共工程如社會住宅、危老屋重建及都市更新及開發等、污水工",
    "程、土地重劃工程"
   ],
   "attribution": "公司年報揭露",
   "verification": {
    "status": "PASS",
    "checks": {
     "source_hash": true,
     "excerpt_found": true,
     "page_match": true,
     "numbers_supported": true,
     "identity": true
    },
    "notes": [],
    "verified_at": "2026-10-12T13:56:41+00:00"
   }
  },
  {
   "id": "5516-AR-07",
   "field": "outlook",
   "statement": "公司於年報載明長期業務發展方面，朝向科研創新產業、物聯網產業及國際化之路線發展。",
   "period": "截至114年度年報刊印日",
   "page": 50,
   "excerpts": [
    "長期：1.秉持誠信、務實、專業、創新之經營理念，並朝向科研創新產業、物",
    "聯網產業及國際化之路線發展"
   ],
   "attribution": "公司年報揭露",
   "verification": {
    "status": "PASS",
    "checks": {
     "source_hash": true,
     "excerpt_found": true,
     "page_match": true,
     "numbers_supported": true,
     "identity": true
    },
    "notes": [],
    "verified_at": "2026-10-12T13:56:41+00:00"
   }
  },
  {
   "id": "5516-AR-08",
   "field": "raw_materials",
   "statement": "公司年報載明營建工程主要的原料包括鋼材、混凝土、水泥及砂石等。",
   "period": "截至114年度年報刊印日",
   "page": 52,
   "excerpts": [
    "營建工程主要的原料為鋼材、混凝土、水泥及砂石"
   ],
   "attribution": "公司年報揭露",
   "verification": {
    "status": "PASS",
    "checks": {
     "source_hash": true,
     "excerpt_found": true,
     "page_match": true,
     "numbers_supported": true,
     "identity": true
    },
    "notes": [],
    "verified_at": "2026-10-12T13:56:41+00:00"
   }
  },
  {
   "id": "5516-AR-09",
   "field": "major_suppliers",
   "statement": "公司年報之主要原料供應狀況表列示，鋼材的主要供應商包括鴻達隆鋼鐵(股)公司、羅東鋼鐵(股)公司、東和鋼鐵企業（股）公司、傢福企業有限公司等。",
   "period": "截至114年度年報刊印日",
   "page": 52,
   "excerpts": [
    "主要原料 主要供應商",
    "鴻達隆鋼鐵(股)公司",
    "羅東鋼鐵(股)公司",
    "東和鋼鐵企業（股）公司",
    "傢福企業有限公司"
   ],
   "attribution": "公司年報揭露",
   "verification": {
    "status": "PASS",
    "checks": {
     "source_hash": true,
     "excerpt_found": true,
     "page_match": true,
     "numbers_supported": true,
     "identity": true
    },
    "notes": [],
    "verified_at": "2026-10-12T13:56:41+00:00"
   }
  },
  {
   "id": "5516-AR-10",
   "field": "major_suppliers",
   "statement": "公司年報之主要原料供應狀況表列示，混凝土的主要供應商包括毅和實業有限公司、永炬企業(股)公司等。",
   "period": "截至114年度年報刊印日",
   "page": 52,
   "excerpts": [
    "主要原料 主要供應商",
    "毅和實業有限公司",
    "永炬企業(股)公司"
   ],
   "attribution": "公司年報揭露",
   "verification": {
    "status": "PASS",
    "checks": {
     "source_hash": true,
     "excerpt_found": true,
     "page_match": true,
     "numbers_supported": true,
     "identity": true
    },
    "notes": [],
    "verified_at": "2026-10-12T13:56:41+00:00"
   }
  },
  {
   "id": "5516-AR-11",
   "field": "major_suppliers",
   "statement": "年報列示之最近二年度主要供應商資料中，113年度正曜營造的進貨金額為新台幣216,378千元，占全年度進貨淨額10.38%。",
   "period": "113年度（2024）",
   "page": 53,
   "excerpts": [
    "最近二年度主要供應商資料",
    "單位:新台幣千元",
    "113 年 114 年 115 年度截至前一季止",
    "占全年度 進貨淨額 比率〔%〕",
    "正曜營造 216,378 10.38%"
   ],
   "attribution": "公司年報揭露",
   "verification": {
    "status": "PASS",
    "checks": {
     "source_hash": true,
     "excerpt_found": true,
     "page_match": true,
     "numbers_supported": true,
     "identity": true
    },
    "notes": [],
    "verified_at": "2026-10-12T13:56:41+00:00"
   }
  },
  {
   "id": "5516-AR-12",
   "field": "major_suppliers",
   "statement": "年報列示之最近二年度主要供應商資料中，114年度正曜營造的進貨金額為新台幣263,937千元，占全年度進貨淨額12.77%。",
   "period": "114年度（2025）",
   "page": 53,
   "excerpts": [
    "最近二年度主要供應商資料",
    "單位:新台幣千元",
    "113 年 114 年 115 年度截至前一季止",
    "占全年度 進貨淨額 比率〔%〕",
    "正曜營造 216,378 10.38% 無 正曜營造 263,937 12.77%"
   ],
   "attribution": "公司年報揭露",
   "verification": {
    "status": "PASS",
    "checks": {
     "source_hash": true,
     "excerpt_found": true,
     "page_match": true,
     "numbers_supported": true,
     "identity": true
    },
    "notes": [],
    "verified_at": "2026-10-12T13:56:41+00:00"
   }
  },
  {
   "id": "5516-AR-13",
   "field": "major_customers",
   "statement": "年報列示之最近二年度主要銷貨客戶資料中，114年度國家住宅及都市更新中心的銷貨金額為新台幣959,611千元，占全年度銷貨淨額44.08%。",
   "period": "114年度（2025）",
   "page": 54,
   "excerpts": [
    "最近二年度主要銷貨客戶資料",
    "單位:新台幣千元",
    "113 年 114 年 115 度截至前一季止",
    "占全年度 銷貨淨額 比率",
    "國家住宅及都市更新中心 959,611 44.08%"
   ],
   "attribution": "公司年報揭露",
   "verification": {
    "status": "PASS",
    "checks": {
     "source_hash": true,
     "excerpt_found": true,
     "page_match": true,
     "numbers_supported": true,
     "identity": true
    },
    "notes": [],
    "verified_at": "2026-10-12T13:56:41+00:00"
   }
  },
  {
   "id": "5516-AR-14",
   "field": "major_customers",
   "statement": "年報列示之最近二年度主要銷貨客戶資料中，114年度桃園市政府的銷貨金額為新台幣505,843千元，占全年度銷貨淨額23.23%。",
   "period": "114年度（2025）",
   "page": 54,
   "excerpts": [
    "最近二年度主要銷貨客戶資料",
    "單位:新台幣千元",
    "113 年 114 年 115 度截至前一季止",
    "占全年度 銷貨淨額 比率",
    "桃園市政府 505,843 23.23%"
   ],
   "attribution": "公司年報揭露",
   "verification": {
    "status": "PASS",
    "checks": {
     "source_hash": true,
     "excerpt_found": true,
     "page_match": true,
     "numbers_supported": true,
     "identity": true
    },
    "notes": [],
    "verified_at": "2026-10-12T13:56:41+00:00"
   }
  },
  {
   "id": "5516-AR-15",
   "field": "major_customers",
   "statement": "年報列示之最近二年度主要銷貨客戶資料中，114年度國家科學及技術委員會的銷貨金額為新台幣428,574千元，占全年度銷貨淨額19.69%。",
   "period": "114年度（2025）",
   "page": 54,
   "excerpts": [
    "最近二年度主要銷貨客戶資料",
    "單位:新台幣千元",
    "113 年 114 年 115 度截至前一季止",
    "占全年度 銷貨淨額 比率",
    "國家科學及技術委員會 428,574 19.69%"
   ],
   "attribution": "公司年報揭露",
   "verification": {
    "status": "PASS",
    "checks": {
     "source_hash": true,
     "excerpt_found": true,
     "page_match": true,
     "numbers_supported": true,
     "identity": true
    },
    "notes": [],
    "verified_at": "2026-10-12T13:56:41+00:00"
   }
  },
  {
   "id": "5516-AR-16",
   "field": "employees",
   "statement": "114年度員工人數為138人（員工人數表未載明為母公司或合併範圍）。",
   "period": "114年度（2025）",
   "page": 55,
   "excerpts": [
    "年度  113 年 114 年",
    "員 工 人 數  142 人 138 人 137 人"
   ],
   "attribution": "公司年報揭露",
   "verification": {
    "status": "PASS",
    "checks": {
     "source_hash": true,
     "excerpt_found": true,
     "page_match": true,
     "numbers_supported": true,
     "identity": true
    },
    "notes": [],
    "verified_at": "2026-10-12T13:56:41+00:00"
   }
  }
 ]
}
