{
 "ticker": "5859",
 "company": "遠壽",
 "legal_name": "遠雄人壽保險事業股份有限公司",
 "source": {
  "citation_url": "https://doc.twse.com.tw/server-java/t57sb01?step=9&kind=F&co_id=5859&filename=2025_5859_20260612F04.pdf",
  "fy": 2025,
  "filename": "2025_5859_20260612F04.pdf",
  "text_sha256": "65d3aeb66263be7bffac0e0bec667439af7d4f4934be83b7e5d3b70a13eb7629",
  "text_path": "audit-v5/source-cache/research-site/mops-annual/65d3aeb66263be7bffac0e0bec667439af7d4f4934be83b7e5d3b70a13eb7629.txt"
 },
 "facts": [
  {
   "id": "5859-AR-01",
   "field": "revenue_mix",
   "statement": "114年度個人壽險保費收入為新台幣34,136,401千元，占總保費收入59,430,307千元之57.44%（年報註明依據財團法人保險事業發展中心數據資料）。",
   "period": "114年度（2025）",
   "page": 85,
   "excerpts": [
    "單位：新台幣千元",
    "項目 114 度保費收入 比率(%)",
    "個人壽險 34,136,401 57.44%",
    "總保費收入 59,430,307 100.00%",
    "註：依據財團法人保險事業發展中心數據資料。"
   ],
   "attribution": "公司年報揭露",
   "verification": {
    "status": "PASS",
    "checks": {
     "source_hash": true,
     "excerpt_found": true,
     "page_match": true,
     "numbers_supported": true,
     "identity": true
    },
    "notes": [],
    "verified_at": "2026-10-13T00:23:46+00:00"
   }
  },
  {
   "id": "5859-AR-02",
   "field": "revenue_mix",
   "statement": "114年度個人健康保險保費收入為新台幣20,697,706千元，占總保費收入59,430,307千元之34.83%（年報註明依據財團法人保險事業發展中心數據資料）。",
   "period": "114年度（2025）",
   "page": 85,
   "excerpts": [
    "單位：新台幣千元",
    "項目 114 度保費收入 比率(%)",
    "個人健康保險 20,697,706 34.83%",
    "總保費收入 59,430,307 100.00%",
    "註：依據財團法人保險事業發展中心數據資料。"
   ],
   "attribution": "公司年報揭露",
   "verification": {
    "status": "PASS",
    "checks": {
     "source_hash": true,
     "excerpt_found": true,
     "page_match": true,
     "numbers_supported": true,
     "identity": true
    },
    "notes": [],
    "verified_at": "2026-10-13T00:23:46+00:00"
   }
  },
  {
   "id": "5859-AR-03",
   "field": "revenue_mix",
   "statement": "114年度個人傷害保險保費收入為新台幣2,151,553千元，占總保費收入59,430,307千元之3.62%（年報註明依據財團法人保險事業發展中心數據資料）。",
   "period": "114年度（2025）",
   "page": 85,
   "excerpts": [
    "單位：新台幣千元",
    "項目 114 度保費收入 比率(%)",
    "個人傷害保險 2,151,553 3.62%",
    "總保費收入 59,430,307 100.00%",
    "註：依據財團法人保險事業發展中心數據資料。"
   ],
   "attribution": "公司年報揭露",
   "verification": {
    "status": "PASS",
    "checks": {
     "source_hash": true,
     "excerpt_found": true,
     "page_match": true,
     "numbers_supported": true,
     "identity": true
    },
    "notes": [],
    "verified_at": "2026-10-13T00:23:46+00:00"
   }
  },
  {
   "id": "5859-AR-04",
   "field": "revenue_mix",
   "statement": "114年度投資型保險保費收入為新台幣1,798,082千元，占總保費收入59,430,307千元之3.03%（年報註明依據財團法人保險事業發展中心數據資料）。",
   "period": "114年度（2025）",
   "page": 85,
   "excerpts": [
    "單位：新台幣千元",
    "項目 114 度保費收入 比率(%)",
    "投資型保險 1,798,082 3.03%",
    "總保費收入 59,430,307 100.00%",
    "註：依據財團法人保險事業發展中心數據資料。"
   ],
   "attribution": "公司年報揭露",
   "verification": {
    "status": "PASS",
    "checks": {
     "source_hash": true,
     "excerpt_found": true,
     "page_match": true,
     "numbers_supported": true,
     "identity": true
    },
    "notes": [],
    "verified_at": "2026-10-13T00:23:46+00:00"
   }
  },
  {
   "id": "5859-AR-05",
   "field": "revenue_mix",
   "statement": "114年度團體保險保費收入為新台幣603,367千元，占總保費收入59,430,307千元之1.02%（年報註明依據財團法人保險事業發展中心數據資料）。",
   "period": "114年度（2025）",
   "page": 85,
   "excerpts": [
    "單位：新台幣千元",
    "項目 114 度保費收入 比率(%)",
    "團體保險 603,367 1.02%",
    "總保費收入 59,430,307 100.00%",
    "註：依據財團法人保險事業發展中心數據資料。"
   ],
   "attribution": "公司年報揭露",
   "verification": {
    "status": "PASS",
    "checks": {
     "source_hash": true,
     "excerpt_found": true,
     "page_match": true,
     "numbers_supported": true,
     "identity": true
    },
    "notes": [],
    "verified_at": "2026-10-13T00:23:46+00:00"
   }
  },
  {
   "id": "5859-AR-06",
   "field": "revenue_mix",
   "statement": "114年度年金保險保費收入為新台幣43,198千元，占總保費收入59,430,307千元之0.07%（年報註明依據財團法人保險事業發展中心數據資料）。",
   "period": "114年度（2025）",
   "page": 85,
   "excerpts": [
    "單位：新台幣千元",
    "項目 114 度保費收入 比率(%)",
    "年金保險 43,198 0.07%",
    "總保費收入 59,430,307 100.00%",
    "註：依據財團法人保險事業發展中心數據資料。"
   ],
   "attribution": "公司年報揭露",
   "verification": {
    "status": "PASS",
    "checks": {
     "source_hash": true,
     "excerpt_found": true,
     "page_match": true,
     "numbers_supported": true,
     "identity": true
    },
    "notes": [],
    "verified_at": "2026-10-13T00:23:46+00:00"
   }
  },
  {
   "id": "5859-AR-07",
   "field": "business_scope",
   "statement": "公司年報載明其屬於人身保險業，業務包括個人壽險、年金保險、個人健康保險、個人傷害保險、投資型保險、團體保險。",
   "period": "截至114年度年報刊印日",
   "page": 85,
   "excerpts": [
    "1.本公司屬於人身保險業，業務分述如下：",
    "(1)個人壽險",
    "(2)年金保險",
    "(3)個人健康保險",
    "(4)個人傷害保險",
    "(5)投資型保險",
    "(6)團體保險"
   ],
   "attribution": "公司年報揭露",
   "verification": {
    "status": "PASS",
    "checks": {
     "source_hash": true,
     "excerpt_found": true,
     "page_match": true,
     "numbers_supported": true,
     "identity": true
    },
    "notes": [],
    "verified_at": "2026-10-13T00:23:46+00:00"
   }
  },
  {
   "id": "5859-AR-08",
   "field": "sales_regions",
   "statement": "公司年報載明主要商品（服務）之銷售（提供）地區為中華民國台、澎、金、馬等地區。",
   "period": "截至114年度年報刊印日",
   "page": 106,
   "excerpts": [
    "主要商品(服務)之銷售(提供)地區：中華民國台、澎、金、馬等地區"
   ],
   "attribution": "公司年報揭露",
   "verification": {
    "status": "PASS",
    "checks": {
     "source_hash": true,
     "excerpt_found": true,
     "page_match": true,
     "numbers_supported": true,
     "identity": true
    },
    "notes": [],
    "verified_at": "2026-10-13T00:23:46+00:00"
   }
  },
  {
   "id": "5859-AR-09",
   "field": "market_position",
   "statement": "公司於年報自述114年度遠雄總保費收入為59,430百萬元（新台幣），壽險業總保費收入為2,623,957百萬元，佔有率為2.26%（年報註明依據中華民國人壽保險同業公會統計數據資料）。",
   "period": "114年度（2025）",
   "page": 106,
   "excerpts": [
    "最近二年市場佔有率一覽表",
    "單位：新台幣百萬元",
    "年度 壽險業總保費收入 遠雄總保費收入 佔有率(%)",
    "114 2,623,957 59,430 2.26%",
    "註：依據中華民國人壽保險同業公會統計數據資料。"
   ],
   "attribution": "公司年報自述（未經獨立驗證的排名或評價）",
   "verification": {
    "status": "PASS",
    "checks": {
     "source_hash": true,
     "excerpt_found": true,
     "page_match": true,
     "numbers_supported": true,
     "identity": true
    },
    "notes": [],
    "verified_at": "2026-10-13T00:23:46+00:00"
   }
  },
  {
   "id": "5859-AR-10",
   "field": "market_position",
   "statement": "公司於年報自述113年度遠雄總保費收入為58,738百萬元（新台幣），壽險業總保費收入為2,440,157百萬元，佔有率為2.41%（年報註明依據中華民國人壽保險同業公會統計數據資料）。",
   "period": "113年度（2024）",
   "page": 106,
   "excerpts": [
    "最近二年市場佔有率一覽表",
    "單位：新台幣百萬元",
    "年度 壽險業總保費收入 遠雄總保費收入 佔有率(%)",
    "113 2,440,157 58,738 2.41%",
    "註：依據中華民國人壽保險同業公會統計數據資料。"
   ],
   "attribution": "公司年報自述（未經獨立驗證的排名或評價）",
   "verification": {
    "status": "PASS",
    "checks": {
     "source_hash": true,
     "excerpt_found": true,
     "page_match": true,
     "numbers_supported": true,
     "identity": true
    },
    "notes": [],
    "verified_at": "2026-10-13T00:23:46+00:00"
   }
  },
  {
   "id": "5859-AR-11",
   "field": "employees",
   "statement": "114年度員工人數合計為4,384人，含內勤人員與外勤人員，並包含內外勤兼職人員（員工人數表未載明為母公司或合併範圍）。",
   "period": "114年度（2025）",
   "page": 112,
   "excerpts": [
    "年度 113 年度 114 年度 當年度截止至",
    "合計 4,198 人 4,384 人 4,312 人",
    "註：上述資料包含內外勤兼職人員。"
   ],
   "attribution": "公司年報揭露",
   "verification": {
    "status": "PASS",
    "checks": {
     "source_hash": true,
     "excerpt_found": true,
     "page_match": true,
     "numbers_supported": true,
     "identity": true
    },
    "notes": [],
    "verified_at": "2026-10-13T00:23:46+00:00"
   }
  },
  {
   "id": "5859-AR-12",
   "field": "employees",
   "statement": "114年度內勤人員為924人（員工人數表未載明為母公司或合併範圍）。",
   "period": "114年度（2025）",
   "page": 112,
   "excerpts": [
    "年度 113 年度 114 年度 當年度截止至",
    "內勤人員 870 人 924 人 908 人"
   ],
   "attribution": "公司年報揭露",
   "verification": {
    "status": "PASS",
    "checks": {
     "source_hash": true,
     "excerpt_found": true,
     "page_match": true,
     "numbers_supported": true,
     "identity": true
    },
    "notes": [],
    "verified_at": "2026-10-13T00:23:46+00:00"
   }
  },
  {
   "id": "5859-AR-13",
   "field": "employees",
   "statement": "114年度外勤人員為3,460人（員工人數表未載明為母公司或合併範圍）。",
   "period": "114年度（2025）",
   "page": 112,
   "excerpts": [
    "年度 113 年度 114 年度 當年度截止至",
    "外勤人員 3,328 人 3,460 人 3,404 人"
   ],
   "attribution": "公司年報揭露",
   "verification": {
    "status": "PASS",
    "checks": {
     "source_hash": true,
     "excerpt_found": true,
     "page_match": true,
     "numbers_supported": true,
     "identity": true
    },
    "notes": [],
    "verified_at": "2026-10-13T00:23:46+00:00"
   }
  },
  {
   "id": "5859-AR-14",
   "field": "outlook",
   "statement": "公司年報列示短期業務計畫包括持續建構多元行銷通路，包括銀行保險、經紀人、團體保險及網路投保等通路。",
   "period": "截至114年度年報刊印日",
   "page": 104,
   "excerpts": [
    "1.短期業務計畫:",
    "多元行銷通路，包括銀行保險、經紀人、團體保險及網路投保等通路"
   ],
   "attribution": "公司年報揭露",
   "verification": {
    "status": "PASS",
    "checks": {
     "source_hash": true,
     "excerpt_found": true,
     "page_match": true,
     "numbers_supported": true,
     "identity": true
    },
    "notes": [],
    "verified_at": "2026-10-13T00:23:46+00:00"
   }
  }
 ]
}
