{
 "ticker": "9934",
 "company": "成霖",
 "legal_name": "成霖企業股份有限公司",
 "source": {
  "citation_url": "https://doc.twse.com.tw/server-java/t57sb01?step=9&kind=F&co_id=9934&filename=2025_9934_20260529F04.pdf",
  "fy": 2025,
  "filename": "2025_9934_20260529F04.pdf",
  "text_sha256": "1a94055de6fa039fecf80e7c9e0fc684dc823a0e4c1570267e9b9a55d36e0f5b",
  "text_path": "audit-v5/source-cache/research-site/mops-annual/1a94055de6fa039fecf80e7c9e0fc684dc823a0e4c1570267e9b9a55d36e0f5b.txt"
 },
 "facts": [
  {
   "id": "9934-AR-01",
   "field": "business_scope",
   "statement": "成霖集團主要營業項目為衛浴產品之設計、製造、行銷及倉儲與物流服務。",
   "period": "截至114年度年報刊印日",
   "page": 106,
   "excerpts": [
    "主要營業項目為衛浴產品之設計、製造、行銷及倉儲與物流服務"
   ],
   "attribution": "公司年報揭露",
   "verification": {
    "status": "PASS",
    "checks": {
     "source_hash": true,
     "excerpt_found": true,
     "page_match": true,
     "numbers_supported": true,
     "identity": true
    },
    "notes": [],
    "verified_at": "2026-10-12T23:54:10+00:00"
   }
  },
  {
   "id": "9934-AR-02",
   "field": "products",
   "statement": "全球衛浴事業體產品涵蓋衛浴陶瓷、水五金及相關配件。",
   "period": "截至114年度年報刊印日",
   "page": 106,
   "excerpts": [
    "全球衛浴事業體（Global Plumbing）：全球衛浴事業體主要從事衛浴產品之研",
    "產品涵蓋衛浴陶瓷、水五金及相關配件"
   ],
   "attribution": "公司年報揭露",
   "verification": {
    "status": "PASS",
    "checks": {
     "source_hash": true,
     "excerpt_found": true,
     "page_match": true,
     "numbers_supported": true,
     "identity": true
    },
    "notes": [],
    "verified_at": "2026-10-12T23:54:10+00:00"
   }
  },
  {
   "id": "9934-AR-03",
   "field": "revenue_mix",
   "statement": "114年度自有品牌（全球衛浴事業體）營業比重為40%。",
   "period": "114年度（2025）",
   "page": 106,
   "excerpts": [
    "營業比重：",
    "業務 114 年度 備註",
    "自有品牌（全球衛浴事業體） 40%"
   ],
   "attribution": "公司年報揭露",
   "verification": {
    "status": "PASS",
    "checks": {
     "source_hash": true,
     "excerpt_found": true,
     "page_match": true,
     "numbers_supported": true,
     "identity": true
    },
    "notes": [],
    "verified_at": "2026-10-12T23:54:10+00:00"
   }
  },
  {
   "id": "9934-AR-04",
   "field": "revenue_mix",
   "statement": "114年度ODM/OEM（全球衛浴事業體）營業比重為18%。",
   "period": "114年度（2025）",
   "page": 106,
   "excerpts": [
    "營業比重：",
    "業務 114 年度 備註",
    "ODM/OEM （全球衛浴事業體） 18%"
   ],
   "attribution": "公司年報揭露",
   "verification": {
    "status": "PASS",
    "checks": {
     "source_hash": true,
     "excerpt_found": true,
     "page_match": true,
     "numbers_supported": true,
     "identity": true
    },
    "notes": [],
    "verified_at": "2026-10-12T23:54:10+00:00"
   }
  },
  {
   "id": "9934-AR-05",
   "field": "revenue_mix",
   "statement": "114年度PJH（英國倉儲物流事業體）營業比重為42%。",
   "period": "114年度（2025）",
   "page": 106,
   "excerpts": [
    "營業比重：",
    "業務 114 年度 備註",
    "PJH     （英國倉儲物流事業體） 42%"
   ],
   "attribution": "公司年報揭露",
   "verification": {
    "status": "PASS",
    "checks": {
     "source_hash": true,
     "excerpt_found": true,
     "page_match": true,
     "numbers_supported": true,
     "identity": true
    },
    "notes": [],
    "verified_at": "2026-10-12T23:54:10+00:00"
   }
  },
  {
   "id": "9934-AR-06",
   "field": "sales_regions",
   "statement": "114年度北美地區銷售金額為新台幣9,178,785仟元，占該表合計17,389,978仟元的52.78%。",
   "period": "114年度（2025）",
   "page": 113,
   "excerpts": [
    "1.主要商品銷售地區 單位：新台幣仟元",
    "114年度 113年度",
    "北美地區 9,178,785 52.78 10,155,938 55.92",
    "合計  17,389,978 100.00 18,161,444 100.00"
   ],
   "attribution": "公司年報揭露",
   "verification": {
    "status": "PASS",
    "checks": {
     "source_hash": true,
     "excerpt_found": true,
     "page_match": true,
     "numbers_supported": true,
     "identity": true
    },
    "notes": [],
    "verified_at": "2026-10-12T23:54:10+00:00"
   }
  },
  {
   "id": "9934-AR-07",
   "field": "sales_regions",
   "statement": "114年度歐洲地區（含英國）銷售金額為新台幣7,982,311仟元，占該表合計17,389,978仟元的45.90%。",
   "period": "114年度（2025）",
   "page": 113,
   "excerpts": [
    "1.主要商品銷售地區 單位：新台幣仟元",
    "114年度 113年度",
    "（含英國） 7,982,311 45.90 7,685,392 42.32",
    "合計  17,389,978 100.00 18,161,444 100.00"
   ],
   "attribution": "公司年報揭露",
   "verification": {
    "status": "PASS",
    "checks": {
     "source_hash": true,
     "excerpt_found": true,
     "page_match": true,
     "numbers_supported": true,
     "identity": true
    },
    "notes": [],
    "verified_at": "2026-10-12T23:54:10+00:00"
   }
  },
  {
   "id": "9934-AR-08",
   "field": "market_position",
   "statement": "公司於年報自述，Gerber品牌在美國市場市占率達6%（年報未載明統計來源）。",
   "period": "截至114年度年報刊印日",
   "page": 113,
   "excerpts": [
    "2.市場占有率：",
    "Gerber 品牌在美國市場市占率達 6%"
   ],
   "attribution": "公司年報自述（未經獨立驗證的排名或評價）",
   "verification": {
    "status": "PASS",
    "checks": {
     "source_hash": true,
     "excerpt_found": true,
     "page_match": true,
     "numbers_supported": true,
     "identity": true
    },
    "notes": [],
    "verified_at": "2026-10-12T23:54:10+00:00"
   }
  },
  {
   "id": "9934-AR-09",
   "field": "major_customers",
   "statement": "114年度甲客戶銷貨金額為新台幣3,137,915仟元，占全年度銷貨淨額18.04%，與發行人之關係為無；客戶以代號列示。",
   "period": "114年度（2025）",
   "page": 119,
   "excerpts": [
    "單位：新台幣仟元",
    "114 年 113 年",
    "1. 甲客戶 3,137,915 18.04 無 甲客戶 3,126,067 17.21 無",
    "銷貨淨額 17,389,978 100.00 銷貨淨額 18,161,444 100.00"
   ],
   "attribution": "公司年報揭露",
   "verification": {
    "status": "PASS",
    "checks": {
     "source_hash": true,
     "excerpt_found": true,
     "page_match": true,
     "numbers_supported": true,
     "identity": true
    },
    "notes": [],
    "verified_at": "2026-10-12T23:54:10+00:00"
   }
  },
  {
   "id": "9934-AR-10",
   "field": "major_suppliers",
   "statement": "年報稱最近二年度進貨產品種類及供應商眾多，無供應商年度進貨占進貨總額百分之十以上。",
   "period": "最近二年度（截至114年度年報刊印日）",
   "page": 119,
   "excerpts": [
    "最近二年度主要供應商資料︰進貨產品種類及供應商眾多，因此無供應商年度進貨占進貨總額百分之十以上之情"
   ],
   "attribution": "公司年報揭露",
   "verification": {
    "status": "PASS",
    "checks": {
     "source_hash": true,
     "excerpt_found": true,
     "page_match": true,
     "numbers_supported": true,
     "identity": true
    },
    "notes": [],
    "verified_at": "2026-10-12T23:54:10+00:00"
   }
  },
  {
   "id": "9934-AR-11",
   "field": "raw_materials",
   "statement": "五金產品主要使用的原材料包括銅、鋅和塑膠等。",
   "period": "截至114年度年報刊印日",
   "page": 119,
   "excerpts": [
    "五金產品主要使用的原材料包括銅、鋅和塑膠等"
   ],
   "attribution": "公司年報揭露",
   "verification": {
    "status": "PASS",
    "checks": {
     "source_hash": true,
     "excerpt_found": true,
     "page_match": true,
     "numbers_supported": true,
     "identity": true
    },
    "notes": [],
    "verified_at": "2026-10-12T23:54:10+00:00"
   }
  },
  {
   "id": "9934-AR-12",
   "field": "raw_materials",
   "statement": "陶瓷衛浴產品的主要原材料包括泥原料、釉原料、石膏粉等。",
   "period": "截至114年度年報刊印日",
   "page": 119,
   "excerpts": [
    "陶瓷衛浴",
    "產品的主要原材料包括泥原料、釉原料、石膏粉等"
   ],
   "attribution": "公司年報揭露",
   "verification": {
    "status": "PASS",
    "checks": {
     "source_hash": true,
     "excerpt_found": true,
     "page_match": true,
     "numbers_supported": true,
     "identity": true
    },
    "notes": [],
    "verified_at": "2026-10-12T23:54:10+00:00"
   }
  },
  {
   "id": "9934-AR-13",
   "field": "rd",
   "statement": "114年度研發費用為新台幣163,788仟元。",
   "period": "114年度（2025）",
   "page": 111,
   "excerpts": [
    "單位：新台幣仟元",
    "項目 114 年 截至115年 2 月28日",
    "研發費用  163,788 25,214"
   ],
   "attribution": "公司年報揭露",
   "verification": {
    "status": "PASS",
    "checks": {
     "source_hash": true,
     "excerpt_found": true,
     "page_match": true,
     "numbers_supported": true,
     "identity": true
    },
    "notes": [],
    "verified_at": "2026-10-12T23:54:10+00:00"
   }
  },
  {
   "id": "9934-AR-14",
   "field": "employees",
   "statement": "114年度合併報表員工人數合計為3,551人。",
   "period": "114年度（2025）",
   "page": 120,
   "excerpts": [
    "合併報表：  115年3月31日",
    "年度 113年度 114年度 當年度截至",
    "合計 4,013 3,551 3,447"
   ],
   "attribution": "公司年報揭露",
   "verification": {
    "status": "PASS",
    "checks": {
     "source_hash": true,
     "excerpt_found": true,
     "page_match": true,
     "numbers_supported": true,
     "identity": true
    },
    "notes": [],
    "verified_at": "2026-10-12T23:54:10+00:00"
   }
  }
 ]
}
