{
 "ticker": "3093",
 "company": "港建",
 "legal_name": "台灣港建股份有限公司",
 "source": {
  "citation_url": "https://doc.twse.com.tw/server-java/t57sb01?step=9&kind=F&co_id=3093&filename=2025_3093_20260616F04.pdf",
  "fy": 2025,
  "filename": "2025_3093_20260616F04.pdf",
  "text_sha256": "1f1efbcbf8d02f0e7bf56da5564a5bf9d89bd39ab0ffdb50e8b4da8f121d9217",
  "text_path": "audit-v5/source-cache/research-site/mops-annual/1f1efbcbf8d02f0e7bf56da5564a5bf9d89bd39ab0ffdb50e8b4da8f121d9217.txt"
 },
 "facts": [
  {
   "id": "3093-AR-01",
   "field": "established",
   "statement": "公司自民國66年創立。",
   "period": "未註明",
   "page": 84,
   "excerpts": [
    "本公司自民國66年創立以來"
   ],
   "attribution": "公司年報揭露",
   "verification": {
    "status": "PASS",
    "checks": {
     "source_hash": true,
     "excerpt_found": true,
     "page_match": true,
     "numbers_supported": true,
     "identity": true
    },
    "notes": [],
    "verified_at": "2026-10-17T19:53:10+00:00"
   }
  },
  {
   "id": "3093-AR-02",
   "field": "business_scope",
   "statement": "本公司及子公司之經營型態係對電子科技產業引進新製程設備及應用技術之銷售及提供客戶服務、電子零件生產、機器設備製造及組裝等。",
   "period": "截至114年度年報刊印日",
   "page": 66,
   "excerpts": [
    "本公司及子公司之經營型態係對電子科技產業引進新製程設備及應用技術",
    "之銷售及提供客戶服務、電子零件生產、機器設備製造及組裝等"
   ],
   "attribution": "公司年報揭露",
   "verification": {
    "status": "PASS",
    "checks": {
     "source_hash": true,
     "excerpt_found": true,
     "page_match": true,
     "numbers_supported": true,
     "identity": true
    },
    "notes": [],
    "verified_at": "2026-10-17T19:53:10+00:00"
   }
  },
  {
   "id": "3093-AR-03",
   "field": "products",
   "statement": "代理經銷項目包括印刷電路板設備及技術服務、化學材料、半導體封裝測試設備、電子組裝設備、光電生產設備及太陽能產業相關設備。",
   "period": "截至114年度年報刊印日",
   "page": 66,
   "excerpts": [
    "營業項目：印刷電路板設備及技術服務、化學材料、半導體封裝測試設備",
    "電子組裝設備、光電生產設備、太陽能產業相關設備"
   ],
   "attribution": "公司年報揭露",
   "verification": {
    "status": "PASS",
    "checks": {
     "source_hash": true,
     "excerpt_found": true,
     "page_match": true,
     "numbers_supported": true,
     "identity": true
    },
    "notes": [],
    "verified_at": "2026-10-17T19:53:10+00:00"
   }
  },
  {
   "id": "3093-AR-04",
   "field": "revenue_mix",
   "statement": "114年電子零件、設備及材料銷售金額為1,724,507仟元，占營業比重92.46%。",
   "period": "114年度（2025）",
   "page": 66,
   "excerpts": [
    "營業項目 114年銷售金額 114 年營業比重",
    "電子零件、設備及材料 1,724,507 92.46%"
   ],
   "attribution": "公司年報揭露",
   "verification": {
    "status": "PASS",
    "checks": {
     "source_hash": true,
     "excerpt_found": true,
     "page_match": true,
     "numbers_supported": true,
     "identity": true
    },
    "notes": [],
    "verified_at": "2026-10-17T19:53:10+00:00"
   }
  },
  {
   "id": "3093-AR-05",
   "field": "revenue_mix",
   "statement": "114年度內銷占營業收入淨額73.67%，外銷占26.33%。",
   "period": "114年度（2025）",
   "page": 83,
   "excerpts": [
    "114年度 113年度",
    "內銷 1,374,045 73.67",
    "外銷 491,152 26.33"
   ],
   "attribution": "公司年報揭露",
   "verification": {
    "status": "PASS",
    "checks": {
     "source_hash": true,
     "excerpt_found": true,
     "page_match": true,
     "numbers_supported": true,
     "identity": true
    },
    "notes": [],
    "verified_at": "2026-10-17T19:53:10+00:00"
   }
  },
  {
   "id": "3093-AR-06",
   "field": "market_position",
   "statement": "公司年報自述40多年來已建立市場普遍信賴之商譽並厚植代理商實力，故可優先取得高階產品代理權。",
   "period": "未註明",
   "page": 83,
   "excerpts": [
    "40多年來已建立了市場普遍信賴",
    "之商譽並厚植了優秀之代理商實力"
   ],
   "attribution": "公司年報自述（未經獨立驗證的排名或評價）",
   "verification": {
    "status": "PASS",
    "checks": {
     "source_hash": true,
     "excerpt_found": true,
     "page_match": true,
     "numbers_supported": true,
     "identity": true
    },
    "notes": [],
    "verified_at": "2026-10-17T19:53:10+00:00"
   }
  },
  {
   "id": "3093-AR-07",
   "field": "outlook",
   "statement": "公司年報引述產業資料，2025年全球PCB產值預估約923.6億美元，年增率15.4%。",
   "period": "2025年",
   "page": 67,
   "excerpts": [
    "2025 年全球PCB 產值預估約923.6 億美元",
    "年增率達15.4%"
   ],
   "attribution": "公司年報引述第三方資料",
   "verification": {
    "status": "PASS",
    "checks": {
     "source_hash": true,
     "excerpt_found": true,
     "page_match": true,
     "numbers_supported": true,
     "identity": true
    },
    "notes": [],
    "verified_at": "2026-10-17T19:53:10+00:00"
   }
  },
  {
   "id": "3093-AR-08",
   "field": "outlook",
   "statement": "公司年報引述產業資料，預估2026年全球PCB產值將達1,052億美元，年成長率為13.9%。",
   "period": "2026年（預測）",
   "page": 68,
   "excerpts": [
    "預估 2026 年全球PCB 產值將達到1,052",
    "年成長率為13.9%"
   ],
   "attribution": "公司年報引述第三方資料",
   "verification": {
    "status": "PASS",
    "checks": {
     "source_hash": true,
     "excerpt_found": true,
     "page_match": true,
     "numbers_supported": true,
     "identity": true
    },
    "notes": [],
    "verified_at": "2026-10-17T19:53:10+00:00"
   }
  },
  {
   "id": "3093-AR-09",
   "field": "raw_materials",
   "statement": "原料供應商大部分為國內外知名廠商，供貨來源相當穩定，價格亦無劇烈之波動。",
   "period": "未註明",
   "page": 89,
   "excerpts": [
    "本公司及子公司之原料供應商大部分為 國內外知名廠商",
    "供貨來源相當穩定，價格亦無劇烈之波動"
   ],
   "attribution": "公司年報揭露",
   "verification": {
    "status": "PASS",
    "checks": {
     "source_hash": true,
     "excerpt_found": true,
     "page_match": true,
     "numbers_supported": true,
     "identity": true
    },
    "notes": [],
    "verified_at": "2026-10-17T19:53:10+00:00"
   }
  },
  {
   "id": "3093-AR-10",
   "field": "major_suppliers",
   "statement": "114年度進貨淨額中，某供應商（年報代號己）占34.62%，另一供應商（年報代號丁）占18.27%。",
   "period": "114年度（2025）",
   "page": 91,
   "excerpts": [
    "115 年度截至前一季止(註 2) 114 年 1 13 年",
    "己供應商 416,585 34.62",
    "丁供應商 219,819 18.27"
   ],
   "attribution": "公司年報揭露",
   "verification": {
    "status": "PASS",
    "checks": {
     "source_hash": true,
     "excerpt_found": true,
     "page_match": true,
     "numbers_supported": true,
     "identity": true
    },
    "notes": [],
    "verified_at": "2026-10-17T19:53:10+00:00"
   }
  },
  {
   "id": "3093-AR-11",
   "field": "major_customers",
   "statement": "114年度銷貨淨額占比最高的客戶（代號B客戶）占50.07%。",
   "period": "114年度（2025）",
   "page": 90,
   "excerpts": [
    "115 年度截至前一季止(註 2) 114 年 1 13 年",
    "B 客戶 933,908 50.07"
   ],
   "attribution": "公司年報揭露",
   "verification": {
    "status": "PASS",
    "checks": {
     "source_hash": true,
     "excerpt_found": true,
     "page_match": true,
     "numbers_supported": true,
     "identity": true
    },
    "notes": [],
    "verified_at": "2026-10-17T19:53:10+00:00"
   }
  },
  {
   "id": "3093-AR-12",
   "field": "employees",
   "statement": "114年底從業員工人數表列合計232人，113年為239人（員工人數表未載明為母公司或合併範圍）。",
   "period": "114年底",
   "page": 92,
   "excerpts": [
    "項目／年度 當年度截至",
    "115年3月31日 114年 113 年",
    "合計 231 232 239"
   ],
   "attribution": "公司年報揭露",
   "verification": {
    "status": "PASS",
    "checks": {
     "source_hash": true,
     "excerpt_found": true,
     "page_match": true,
     "numbers_supported": true,
     "identity": true
    },
    "notes": [],
    "verified_at": "2026-10-17T19:53:10+00:00"
   }
  },
  {
   "id": "3093-AR-13",
   "field": "group_structure",
   "statement": "公司亦在台灣、中國等地成立子公司。",
   "period": "未註明",
   "page": 85,
   "excerpts": [
    "本公司亦在台灣、中國等地成立子公司"
   ],
   "attribution": "公司年報揭露",
   "verification": {
    "status": "PASS",
    "checks": {
     "source_hash": true,
     "excerpt_found": true,
     "page_match": true,
     "numbers_supported": true,
     "identity": true
    },
    "notes": [],
    "verified_at": "2026-10-17T19:53:10+00:00"
   }
  }
 ]
}
