{
 "ticker": "8163",
 "company": "達方",
 "legal_name": "達方電子股份有限公司",
 "source": {
  "citation_url": "https://doc.twse.com.tw/server-java/t57sb01?step=9&kind=F&co_id=8163&filename=2025_8163_20260527F04.pdf",
  "fy": 2025,
  "filename": "2025_8163_20260527F04.pdf",
  "text_sha256": "b25f37c2b48ec25a09355f49d9bd9ce367252ef2a117900767f9d5fa57cc62ed",
  "text_path": "audit-v5/source-cache/research-site/mops-annual/b25f37c2b48ec25a09355f49d9bd9ce367252ef2a117900767f9d5fa57cc62ed.txt"
 },
 "facts": [
  {
   "id": "8163-AR-01",
   "field": "business_scope",
   "statement": "公司所營業務主要從事電腦、智慧型手機週邊產品、通訊相關產品元件、顯示器重要元件、電源暨儲能產品、太陽能發電重要設備與電動輔助自行車等產品之研發、製造、銷售、諮詢顧問及技術服務。",
   "period": "114年度（2025）",
   "page": 48,
   "excerpts": [
    "所營業務主要從事電腦、智慧型手機週邊產品、通訊相關產品元件、顯示器重要元件、電源暨儲能產品、太陽能發電重要設備與電動輔助自行車等產品之研發、製造、銷售、諮詢顧問及技術服務"
   ],
   "attribution": "公司年報揭露",
   "verification": {
    "status": "PASS",
    "checks": {
     "source_hash": true,
     "excerpt_found": true,
     "page_match": true,
     "numbers_supported": true,
     "identity": true
    },
    "notes": [],
    "verified_at": "2026-10-12T04:00:40+00:00"
   }
  },
  {
   "id": "8163-AR-02",
   "field": "business_scope",
   "statement": "公司於年報自述為世界級光電與精密元件的領導專家。",
   "period": "114年度（2025）",
   "page": 48,
   "excerpts": [
    "達方為世界級光電與精密元件的領導專家"
   ],
   "attribution": "公司年報自述（未經獨立驗證的排名或評價）",
   "verification": {
    "status": "PASS",
    "checks": {
     "source_hash": true,
     "excerpt_found": true,
     "page_match": true,
     "numbers_supported": true,
     "identity": true
    },
    "notes": [],
    "verified_at": "2026-10-12T04:00:40+00:00"
   }
  },
  {
   "id": "8163-AR-03",
   "field": "revenue_mix",
   "statement": "2025年度智能產品營業收入淨額為15,436,530仟元，占營業比重62%。",
   "period": "114年度（2025）",
   "page": 48,
   "excerpts": [
    "2025年度",
    "智能產品 15,436,530 62"
   ],
   "attribution": "公司年報揭露",
   "verification": {
    "status": "PASS",
    "checks": {
     "source_hash": true,
     "excerpt_found": true,
     "page_match": true,
     "numbers_supported": true,
     "identity": true
    },
    "notes": [],
    "verified_at": "2026-10-12T04:00:40+00:00"
   }
  },
  {
   "id": "8163-AR-04",
   "field": "revenue_mix",
   "statement": "2025年度綠能產品營業收入淨額為9,637,266仟元，占營業比重38%。",
   "period": "114年度（2025）",
   "page": 48,
   "excerpts": [
    "2025年度",
    "綠能產品 9,637,266 38"
   ],
   "attribution": "公司年報揭露",
   "verification": {
    "status": "PASS",
    "checks": {
     "source_hash": true,
     "excerpt_found": true,
     "page_match": true,
     "numbers_supported": true,
     "identity": true
    },
    "notes": [],
    "verified_at": "2026-10-12T04:00:40+00:00"
   }
  },
  {
   "id": "8163-AR-05",
   "field": "sales_regions",
   "statement": "2025年度內銷金額為4,335,026仟元，占銷售比重17%。",
   "period": "114年度（2025）",
   "page": 52,
   "excerpts": [
    "2024年度 2025年度",
    "內   銷 4,476,937 21 4,335,026 17"
   ],
   "attribution": "公司年報揭露",
   "verification": {
    "status": "PASS",
    "checks": {
     "source_hash": true,
     "excerpt_found": true,
     "page_match": true,
     "numbers_supported": true,
     "identity": true
    },
    "notes": [],
    "verified_at": "2026-10-12T04:00:40+00:00"
   }
  },
  {
   "id": "8163-AR-06",
   "field": "sales_regions",
   "statement": "2025年度外銷金額為20,738,770仟元，占銷售比重83%。",
   "period": "114年度（2025）",
   "page": 52,
   "excerpts": [
    "2024年度 2025年度",
    "外   銷 17,223,289 79 20,738,770 83"
   ],
   "attribution": "公司年報揭露",
   "verification": {
    "status": "PASS",
    "checks": {
     "source_hash": true,
     "excerpt_found": true,
     "page_match": true,
     "numbers_supported": true,
     "identity": true
    },
    "notes": [],
    "verified_at": "2026-10-12T04:00:40+00:00"
   }
  },
  {
   "id": "8163-AR-07",
   "field": "major_customers",
   "statement": "年報表格揭露2025年度銷貨客戶甲公司（代號）金額為2,010,935仟元，占銷貨淨額8%。",
   "period": "114年度（2025）",
   "page": 55,
   "excerpts": [
    "2024 年度 2025 年度 2026 年度截至前一季止",
    "甲公司 2,010,935 8"
   ],
   "attribution": "公司年報揭露",
   "verification": {
    "status": "PASS",
    "checks": {
     "source_hash": true,
     "excerpt_found": true,
     "page_match": true,
     "numbers_supported": true,
     "identity": true
    },
    "notes": [],
    "verified_at": "2026-10-12T04:00:40+00:00"
   }
  },
  {
   "id": "8163-AR-08",
   "field": "major_customers",
   "statement": "年報表格揭露2025年度銷貨客戶乙公司（代號）金額為1,775,655仟元，占銷貨淨額7%。",
   "period": "114年度（2025）",
   "page": 55,
   "excerpts": [
    "2024 年度 2025 年度 2026 年度截至前一季止",
    "乙公司 1,724,425 8 - 乙公司 1,775,655 7"
   ],
   "attribution": "公司年報揭露",
   "verification": {
    "status": "PASS",
    "checks": {
     "source_hash": true,
     "excerpt_found": true,
     "page_match": true,
     "numbers_supported": true,
     "identity": true
    },
    "notes": [],
    "verified_at": "2026-10-12T04:00:40+00:00"
   }
  },
  {
   "id": "8163-AR-09",
   "field": "raw_materials",
   "statement": "背光模組轉換器主要原料為鐵芯、線架、漆包銅線、高壓電容、電源晶片及印刷電路板等。",
   "period": "114年度（2025）",
   "page": 54,
   "excerpts": [
    "背光模組轉換器主要原料為鐵芯、線架、漆包銅線、高壓電容、電源晶片及印刷電路板等"
   ],
   "attribution": "公司年報揭露",
   "verification": {
    "status": "PASS",
    "checks": {
     "source_hash": true,
     "excerpt_found": true,
     "page_match": true,
     "numbers_supported": true,
     "identity": true
    },
    "notes": [],
    "verified_at": "2026-10-12T04:00:40+00:00"
   }
  },
  {
   "id": "8163-AR-10",
   "field": "rd",
   "statement": "2025年研發費用為970,046仟元，2024年為1,014,855仟元。",
   "period": "114年度（2025）",
   "page": 51,
   "excerpts": [
    "項目 2024 年 2025 年",
    "研發費用 1,014,855 970,046"
   ],
   "attribution": "公司年報揭露",
   "verification": {
    "status": "PASS",
    "checks": {
     "source_hash": true,
     "excerpt_found": true,
     "page_match": true,
     "numbers_supported": true,
     "identity": true
    },
    "notes": [],
    "verified_at": "2026-10-12T04:00:40+00:00"
   }
  },
  {
   "id": "8163-AR-11",
   "field": "employees",
   "statement": "2025年12月31日員工合計6,114人，2024年12月31日為6,390人。",
   "period": "114年度（2025）",
   "page": 55,
   "excerpts": [
    "年              度 2024 年 12 月 31 日 2025 年 12 月 31 日",
    "合    計 6,390 6,114 5,875"
   ],
   "attribution": "公司年報揭露",
   "verification": {
    "status": "PASS",
    "checks": {
     "source_hash": true,
     "excerpt_found": true,
     "page_match": true,
     "numbers_supported": true,
     "identity": true
    },
    "notes": [],
    "verified_at": "2026-10-12T04:00:40+00:00"
   }
  }
 ]
}
